{
  "$schema": "../../../../docs/metadata/component-documentation.schema.json",
  "schemaVersion": 1,
  "componentId": "select",
  "owner": {
    "package": "@vyrnforge/ui-elements",
    "source": "packages/ui-elements/src/components/selection.ts"
  },
  "purpose": "Native select control with VyrnForge styling.",
  "guidance": {
    "useWhen": "Use for small to medium option lists.",
    "avoidWhen": "Avoid for multi-select until MultiSelect exists.",
    "aiUsageNotes": "Use native select before inventing custom dropdowns."
  },
  "limitations": [
    "Avoid for multi-select until MultiSelect exists."
  ],
  "relatedComponents": [
    "Field",
    "SegmentedControl"
  ],
  "accessibility": {
    "notes": "Provide label and meaningful option text.",
    "evidenceRefs": []
  },
  "theming": {
    "classes": [
      "vf-select"
    ],
    "variables": []
  },
  "examples": [],
  "releaseNotes": []
}
