{
  "$schema": "../../../../docs/metadata/component-documentation.schema.json",
  "schemaVersion": 1,
  "componentId": "radio-group",
  "owner": {
    "package": "@vyrnforge/ui-elements",
    "source": "packages/ui-elements/src/components/selection.ts"
  },
  "purpose": "Fieldset-based radio group with label, description, error, orientation, disabled, required, controlled, and uncontrolled state.",
  "guidance": {
    "useWhen": "Use for mutually exclusive choice sets in forms and settings.",
    "avoidWhen": "Avoid for long option lists; use Select instead.",
    "aiUsageNotes": "Prefer RadioGroup over hand-built radio collections."
  },
  "limitations": ["Avoid for long option lists; use Select instead."],
  "relatedComponents": ["Radio", "Field", "ValidationMessage"],
  "accessibility": {
    "notes": "Uses fieldset/legend and native radio keyboard behavior.",
    "evidenceRefs": []
  },
  "theming": {
    "classes": ["vf-radio-group"],
    "variables": []
  },
  "examples": [],
  "releaseNotes": []
}
